{
  "schema_version": 1,
  "upstream": {
    "repository": "cc-rpi",
    "commit": "aa3ea57fb26ae2e1e167acada4b769e073a417f4",
    "version": "2.1.0",
    "license": "LICENSE",
    "note": "Pinned source commit, not a published 2.1.0 release tag."
  },
  "components": [
    {
      "id": "skill:rpi-adopt",
      "kind": "skill",
      "source": "templates/skills/rpi-adopt",
      "source_sha256": "f4d67d484fe3adaa325ed8aba326b1994772ef791de9a2e03116906fd808cc30",
      "disposition": "adapted",
      "rationale": "Pinned portable workflow contract is authored as a canonical Copilot skill in Phase 1.",
      "destination": "templates/skills/rpi-adopt",
      "destination_sha256": "a9ac7a6ab330b5d6869c3f188ad124f9777366e4871f8fc72fe376f3f326f008",
      "adaptation_note": "Copilot project skill location and explicit adopter lifecycle authority."
    },
    {
      "id": "skill:rpi-assess",
      "kind": "skill",
      "source": "templates/skills/rpi-assess",
      "source_sha256": "27ef366efb3bb505111537647f9daab01067f3d448cac2602cf998c0311eb7d7",
      "disposition": "adapted",
      "rationale": "Pinned portable workflow contract is authored as a canonical Copilot skill in Phase 1.",
      "destination": "templates/skills/rpi-assess",
      "destination_sha256": "123001b6e53f95464a0abcdb00870ef630cd22b519adbb0363159148dfb0fd55",
      "adaptation_note": "Copilot invocation with source-cited evaluation distinct from research."
    },
    {
      "id": "skill:rpi-brainstorm",
      "kind": "skill",
      "source": "templates/skills/rpi-brainstorm",
      "source_sha256": "354bcf06ac7840a264d10a40f522a2286938c12c73579417c6eda591b5fa03fe",
      "disposition": "adapted",
      "rationale": "Pinned portable workflow contract is authored as a canonical Copilot skill in Phase 1.",
      "destination": "templates/skills/rpi-brainstorm",
      "destination_sha256": "354bcf06ac7840a264d10a40f522a2286938c12c73579417c6eda591b5fa03fe",
      "adaptation_note": "Copilot skill metadata, explicit local authority and native path wording while retaining the portable workflow contract."
    },
    {
      "id": "skill:rpi-bootstrap",
      "kind": "skill",
      "source": "templates/skills/rpi-bootstrap",
      "source_sha256": "aa78f5941ab911717a733b88432989a9a3de98e3ec9595c3723ed9bf4d0ce010",
      "disposition": "adapted",
      "rationale": "Pinned portable workflow contract is authored as a canonical Copilot skill in Phase 1.",
      "destination": "templates/skills/rpi-bootstrap",
      "destination_sha256": "38381c63a1c45c7b1b482f143b75020df79a56ec101d9bbf003c187f76c653f6",
      "adaptation_note": "Copilot project skill location and explicit bootstrap lifecycle authority."
    },
    {
      "id": "skill:rpi-describe-pr",
      "kind": "skill",
      "source": "templates/skills/rpi-describe-pr",
      "source_sha256": "2bbaf5be20b9c82b10217ae464a216b43c7e3198a24aa9e8f753e41b13f99046",
      "disposition": "adapted",
      "rationale": "Pinned portable workflow contract is authored as a canonical Copilot skill in Phase 1.",
      "destination": "templates/skills/rpi-describe-pr",
      "destination_sha256": "64a11bf14242162d98cf10c0fff773a1631e15e013efe6f07118889938950839",
      "adaptation_note": "Copilot skill metadata, explicit local authority and native path wording while retaining the portable workflow contract."
    },
    {
      "id": "skill:rpi-detach",
      "kind": "skill",
      "source": "templates/skills/rpi-detach",
      "source_sha256": "5df04fb7407136827e10521c90c2c9077ce40e5e8f7bf3a2a1d45f9792a3e620",
      "disposition": "adapted",
      "rationale": "Pinned portable workflow contract is authored as a canonical Copilot skill in Phase 1.",
      "destination": "templates/skills/rpi-detach",
      "destination_sha256": "dd689973edd952525375851465025db0224d69e8c76c9ef4fd2aa0a9034c2ca2",
      "adaptation_note": "Copilot project skill location and owner-preserving detach contract."
    },
    {
      "id": "skill:rpi-explore-release",
      "kind": "skill",
      "source": "templates/skills/rpi-explore-release",
      "source_sha256": "403148f5e8ed126c71ed3a722a3596a845ff1fbca5bf792ef442ee5fdc205cae",
      "disposition": "adapted",
      "rationale": "Pinned portable workflow contract is authored as a canonical Copilot skill in Phase 1.",
      "destination": "templates/skills/rpi-explore-release",
      "destination_sha256": "60a8d9d8aa54555fe092bef3a9f5c3c18b1595c6fdc75b253d127f342756965c",
      "adaptation_note": "Copilot skill metadata, explicit local authority and native path wording while retaining the portable workflow contract."
    },
    {
      "id": "skill:rpi-fix-ci",
      "kind": "skill",
      "source": "templates/skills/rpi-fix-ci",
      "source_sha256": "8b71322a0022c8afe31f8bd44b9b8f3e4584c1796d68f1f4a9e9c66f600aa561",
      "disposition": "adapted",
      "rationale": "Pinned portable workflow contract is authored as a canonical Copilot skill in Phase 1.",
      "destination": "templates/skills/rpi-fix-ci",
      "destination_sha256": "74da2a58386a6280c5f28b65b78c887c3aa6c3982a36627a92e2013622e23c7c",
      "adaptation_note": "Copilot skill metadata, explicit local authority and native path wording while retaining the portable workflow contract."
    },
    {
      "id": "skill:rpi-implement",
      "kind": "skill",
      "source": "templates/skills/rpi-implement",
      "source_sha256": "de95fd913f7fe401fc0dff1b612949bc8372e9f8a3b533c38f004c68bd456492",
      "disposition": "adapted",
      "rationale": "Pinned portable workflow contract is authored as a canonical Copilot skill in Phase 1.",
      "destination": "templates/skills/rpi-implement",
      "destination_sha256": "2b7569a2c54411b9a1bb26ccd033f267ec0f1b8de827f4d34616fe5abfaa7cd9",
      "adaptation_note": "Copilot invocation, local integration authority and phase handoff."
    },
    {
      "id": "skill:rpi-plan",
      "kind": "skill",
      "source": "templates/skills/rpi-plan",
      "source_sha256": "658a42542b971cb7699d00c4787a592e44d910f21c334c19f9cdf38becfd4219",
      "disposition": "adapted",
      "rationale": "Pinned portable workflow contract is authored as a canonical Copilot skill in Phase 1.",
      "destination": "templates/skills/rpi-plan",
      "destination_sha256": "c91817cbe422fa0393c884600e722c2361039985be22ce8a99a4712cf44957d4",
      "adaptation_note": "Copilot skill metadata, explicit local authority and native path wording while retaining the portable workflow contract."
    },
    {
      "id": "skill:rpi-pre-launch",
      "kind": "skill",
      "source": "templates/skills/rpi-pre-launch",
      "source_sha256": "63dcc413baeef53887630d153fe2389e084c60a15776d3e1f34abbc79640a110",
      "disposition": "adapted",
      "rationale": "Pinned portable workflow contract is authored as a canonical Copilot skill in Phase 1.",
      "destination": "templates/skills/rpi-pre-launch",
      "destination_sha256": "34368b5e911c4d084955e06ed5781fb4a3589f9d1779ba8a592835751b9be966",
      "adaptation_note": "Copilot skill metadata, explicit local authority and native path wording while retaining the portable workflow contract."
    },
    {
      "id": "skill:rpi-release",
      "kind": "skill",
      "source": "templates/skills/rpi-release",
      "source_sha256": "def0f1c576a73d8efba2d503241e8c69457c5320907f70b39458eb89e0f0ddaa",
      "disposition": "adapted",
      "rationale": "Pinned portable workflow contract is authored as a canonical Copilot skill in Phase 1.",
      "destination": "templates/skills/rpi-release",
      "destination_sha256": "8c98eb421303879f537adadac347f3bee995c4490be5cd8dbb17036c9c8f9fe1",
      "adaptation_note": "Copilot invocation with local candidate proof and separately authorized publication."
    },
    {
      "id": "skill:rpi-remediate",
      "kind": "skill",
      "source": "templates/skills/rpi-remediate",
      "source_sha256": "c6ee055e5772b24ca61422f90813803fc39d6b777e35872c6783c746f9f1f534",
      "disposition": "adapted",
      "rationale": "Pinned portable workflow contract is authored as a canonical Copilot skill in Phase 1.",
      "destination": "templates/skills/rpi-remediate",
      "destination_sha256": "2947f6bc5618515169ea8cf500be0b63333ab2fd141b0dcfff2154b24799b09d",
      "adaptation_note": "Copilot skill metadata, explicit local authority and native path wording while retaining the portable workflow contract."
    },
    {
      "id": "skill:rpi-research",
      "kind": "skill",
      "source": "templates/skills/rpi-research",
      "source_sha256": "7e015f9955fb19e6433f75d3c22f2c050c57f8a85a543a4c43aa0dd0dbcdbbd5",
      "disposition": "adapted",
      "rationale": "Pinned portable workflow contract is authored as a canonical Copilot skill in Phase 1.",
      "destination": "templates/skills/rpi-research",
      "destination_sha256": "cee38d9a42df4fb291f25bc022deb5ba4dd0ea2381a8fe017b9f7ececf6275b1",
      "adaptation_note": "Copilot skill metadata, explicit local authority and native path wording while retaining the portable workflow contract."
    },
    {
      "id": "skill:rpi-status",
      "kind": "skill",
      "source": "templates/skills/rpi-status",
      "source_sha256": "7363cd497f356e287203ad0a05d0dfd563106ed72cfc0a4c06551cee1d486a44",
      "disposition": "adapted",
      "rationale": "Pinned portable workflow contract is authored as a canonical Copilot skill in Phase 1.",
      "destination": "templates/skills/rpi-status",
      "destination_sha256": "1da1ddb242396984f1288f73c7f8b2bafb03d5e1c4c5cb5de0636541c886e121",
      "adaptation_note": "Copilot skill metadata, explicit local authority and native path wording while retaining the portable workflow contract."
    },
    {
      "id": "skill:rpi-tool-design",
      "kind": "skill",
      "source": "templates/skills/rpi-tool-design",
      "source_sha256": "ebf193a05053bc4647ea9f76ecfee482e13f075ce3bcce1cbe45a5b9227de9ce",
      "disposition": "adapted",